{
	"schemaVersion":"1.8.0",
	"engine":{
		"name":"QREKMatrices",
		"version":"0.21.0"
	},
	"catalogue":{
		"id":"d-1--n4",
		"affineType":"D(1)",
		"rank":4,
		"layout":"lazy-v1"
	},
	"diagram":{
		"id":"d-1--n4--x1-2-3--tau0-3-2-1-4",
		"spec":{
			"affineType":"D(1)",
			"rank":4,
			"nodes":[
				0,
				1,
				2,
				3,
				4
			],
			"X":[
				1,
				2,
				3
			],
			"tau":[
				0,
				3,
				2,
				1,
				4
			]
		},
		"data":{
			"cartanMatrix":[
				[
					2,
					0,
					-1,
					0,
					0
				],
				[
					0,
					2,
					-1,
					0,
					0
				],
				[
					-1,
					-1,
					2,
					-1,
					-1
				],
				[
					0,
					0,
					-1,
					2,
					0
				],
				[
					0,
					0,
					-1,
					0,
					2
				]
			],
			"symmetrizers":[
				{
					"kind":"integer",
					"value":"1"
				},
				{
					"kind":"integer",
					"value":"1"
				},
				{
					"kind":"integer",
					"value":"1"
				},
				{
					"kind":"integer",
					"value":"1"
				},
				{
					"kind":"integer",
					"value":"1"
				}
			]
		},
		"classification":{
			"status":"Classified",
			"family":"D.3",
			"candidateFamilies":[
				"D.3"
			],
			"regime":"NoVectorKMatrix",
			"equation":"Standard",
			"parameters":{},
			"representativeFamily":"D.3",
			"representativePermutation":[
				0,
				1,
				2,
				3,
				4
			]
		},
		"familyMemberships":[
			{
				"familyId":"D.3",
				"membershipStatus":"classified",
				"regime":"NoVectorKMatrix",
				"formulaBranchId":null,
				"parameters":{},
				"representative":true,
				"transportPermutation":[
					0,
					1,
					2,
					3,
					4
				]
			}
		],
		"qsp":{
			"qspId":"d-1--n4--x1-2-3--tau0-3-2-1-4--qsp",
			"status":"instantiatedPresentation",
			"nameLatex":"B_{\\mathbf c,\\mathbf s}(X,\\tau)",
			"ambientAlgebraLatex":"U_q(\\mathfrak g)",
			"indexSets":{
				"nodes":[
					0,
					1,
					2,
					3,
					4
				],
				"levi":[
					1,
					2,
					3
				],
				"boundary":[
					0,
					4
				],
				"torusOrbitRepresentatives":[
					0,
					4
				]
			},
			"theta":{
				"kind":"KolbQuantumInvolution",
				"longestParabolicWord":[
					1,
					2,
					1,
					3,
					2,
					1
				],
				"latex":"\\theta_q=T_{w_X}\\,\\tau\\,\\omega_q"
			},
			"generatorGroups":[
				{
					"kind":"positiveLevi",
					"nodes":[
						1,
						2,
						3
					],
					"latex":"U_q(\\mathfrak n_X^+)=\\langle x_i\\mid i\\in X\\rangle"
				},
				{
					"kind":"thetaFixedTorus",
					"nodes":[
						0,
						4
					],
					"latex":"U_q(\\mathfrak h)^{\\theta_q}=\\langle k_i^{\\pm1}\\ (i\\in X),\\ k_jk_{\\tau(j)}^{-1},\\ k_j^{-1}k_{\\tau(j)}\\ (j\\in I^*)\\rangle"
				},
				{
					"kind":"boundary",
					"nodes":[
						0,
						1,
						2,
						3,
						4
					],
					"latex":"b_i=\\begin{cases}y_i,&i\\in X,\\\\ y_i+c_i\\theta_q(y_i k_i)k_i^{-1}-s_i k_i^{-1},&i\\notin X.\\end{cases}"
				}
			],
			"presentationLatex":"B_{\\mathbf c,\\mathbf s}(X,\\tau)=\\langle U_q(\\mathfrak n_X^+),\\ U_q(\\mathfrak h)^{\\theta_q},\\ b_i\\ (i\\in I)\\rangle",
			"parameters":{
				"cNodes":[
					0,
					4
				],
				"sNodes":[
					0,
					4
				],
				"latex":"\\mathbf c\\in(\\mathbb K^\\times)^{I\\setminus X},\\qquad \\mathbf s\\in\\mathbb K^{I\\setminus X}"
			},
			"relationStatus":"generatorPresentation",
			"provenance":{
				"Source":"qRE\/files\/algebras.tex",
				"Equations":[
					"theta_q",
					"def:b_j",
					"def:Bcs"
				],
				"Convention":"KolbDef5.6Variation2"
			}
		},
		"reflectionEquation":{
			"kind":"Standard",
			"status":"instantiatedIdentity",
			"latex":"R_{21}(u\/v)K_1(u)R_{12}(uv)K_2(v)=K_2(v)R_{21}(uv)K_1(u)R_{12}(u\/v)",
			"rMatrixId":"d-1--n4--vector-r",
			"verification":{
				"status":"notComputed",
				"method":null,
				"certificateIds":[]
			},
			"conventions":{
				"spectralParameters":"multiplicative",
				"legNumbering":"12\/21",
				"partialTranspose":null
			}
		},
		"capabilities":{
			"qspAlgebra":true,
			"kMatrix":false,
			"rMatrix":true,
			"properties":[],
			"remoteComputation":false
		},
		"computation":{
			"status":"NoVectorKMatrix",
			"solution":null,
			"candidates":[]
		}
	}
}